[
  {
    "kind": "datasheet",
    "url": "https://jlcpcb.com/api/file/downloadByFileSystemAccessId/8590905896883478528",
    "revision": "not stated in PDF",
    "sha256": "9b30040165d64ea88904681688dd4e942807ec5604ca87180c4e607e8eef54b1",
    "accessed_date": "2026-08-09",
    "pages_referenced": [
      "p. 1",
      "p. 2",
      "p. 3"
    ],
    "placeholder": false
  }
]
