[
  {
    "kind": "datasheet",
    "url": "https://jlcpcb.com/api/file/downloadByFileSystemAccessId/8579707595575525376",
    "revision": "04-Aug-15",
    "sha256": "218ec1c8c9977510a599e00b97da1475544f4a1c1db7ef1f678bb6591108e9e5",
    "accessed_date": "2026-08-09",
    "pages_referenced": [
      "p. 1",
      "p. 2",
      "p. 3",
      "p. 4"
    ],
    "placeholder": false
  }
]
