[
  {
    "kind": "datasheet",
    "url": "https://www.kingbrightusa.com/images/catalog/SPEC/WP7113ID.pdf",
    "revision": "Spec DSAF0012 / 1101005042 Rev V.14A, 01/08/2026",
    "sha256": "b5bb33f69c13fd92ab6d47a8fd71168b6e7ee685139c8f381957aeea9286c9da",
    "accessed_date": "2026-08-06",
    "pages_referenced": [
      "p. 1",
      "p. 2",
      "p. 3"
    ],
    "placeholder": false
  }
]
