[
  {
    "kind": "datasheet",
    "url": "https://jlcpcb.com/api/file/downloadByFileSystemAccessId/8590904985322266624",
    "revision": "1.0",
    "sha256": "b18dc9c88fa20a5721432cefe8e28f9e3b9ef4a5f67b67efff765926b3547c3c",
    "accessed_date": "2026-08-10",
    "pages_referenced": [
      "p. 1",
      "p. 2"
    ],
    "placeholder": false
  }
]
