[
  {
    "kind": "datasheet",
    "url": "https://jlcpcb.com/api/file/downloadByFileSystemAccessId/8755880547556175872",
    "revision": "Nov.2024",
    "sha256": "48baeff8d527388544a2eec382a63aa5fce2ef5f944de2cf4f279b1995e65f5e",
    "accessed_date": "2026-08-10",
    "pages_referenced": [
      "p. 1",
      "p. 2",
      "p. 3",
      "p. 4",
      "p. 5",
      "p. 6",
      "p. 7",
      "p. 8"
    ],
    "placeholder": false
  }
]
