[
  {
    "kind": "datasheet",
    "url": "https://jlcpcb.com/api/file/downloadByFileSystemAccessId/8588904509099945984",
    "revision": "PMEG4010ESB v.3, 20151127; 27 November 2015",
    "sha256": "0b45b494bc453a88498b820484e9c22af7cf205ab55655544b71e124b7816d48",
    "accessed_date": "2026-08-09",
    "pages_referenced": [
      "p. 1",
      "p. 2",
      "p. 3",
      "p. 4",
      "p. 5",
      "p. 6",
      "p. 7",
      "p. 8",
      "p. 9",
      "p. 10",
      "p. 11",
      "p. 12",
      "p. 13",
      "p. 14"
    ],
    "placeholder": false
  }
]
