[
  {
    "kind": "datasheet",
    "url": "https://jlcpcb.com/api/file/downloadByFileSystemAccessId/8586202642868031488",
    "revision": "Rev 5: Jan 2011",
    "sha256": "356a21bf75cd5b69da5c4fbd1fb6912e09bb81720a15a50560515e81fe3dd6f9",
    "accessed_date": "2026-08-10",
    "pages_referenced": [
      "p. 1",
      "p. 2",
      "p. 3",
      "p. 4",
      "p. 5",
      "p. 6"
    ],
    "placeholder": false
  }
]
