[
  {
    "kind": "datasheet",
    "url": "https://jlcpcb.com/api/file/downloadByFileSystemAccessId/8586187899393462272",
    "revision": "Revision not stated in supplied PDF",
    "sha256": "51dea2e1b5f9fd7805e30c2a0328a5021a96c343f9be5f155d26103e7f50d0f5",
    "accessed_date": "2026-08-09",
    "pages_referenced": [
      "p. 1",
      "p. 2",
      "p. 3",
      "p. 4"
    ],
    "placeholder": false
  }
]
