[
  {
    "kind": "datasheet",
    "url": "https://jlcpcb.com/api/file/downloadByFileSystemAccessId/8588902298114805760",
    "revision": "DS30270 Rev. 10 - 2, April 2016",
    "sha256": "2cf3ed813df81c6e74755318e2a424a4a25f061f2fa0a63c811abacbc4ae5c9e",
    "accessed_date": "2026-08-09",
    "pages_referenced": [
      "p. 1",
      "p. 2",
      "p. 3",
      "p. 4",
      "p. 5",
      "p. 6"
    ],
    "placeholder": false
  }
]
