[
  {
    "kind": "datasheet",
    "url": "https://www.ti.com/lit/ds/symlink/lm386.pdf",
    "revision": "SNAS545D, May 2004, revised August 2023",
    "sha256": "4fb8c1973f5a087b94493589b9154e0109f4f6edb1454d28c5a49c289df7b3d0",
    "accessed_date": "2026-08-09",
    "pages_referenced": [
      "p. 1",
      "p. 3",
      "p. 4",
      "p. 5",
      "p. 6",
      "p. 10"
    ],
    "placeholder": false
  }
]
