[
  {
    "kind": "datasheet",
    "url": "https://jlcpcb.com/api/file/downloadByFileSystemAccessId/8590905050347237376",
    "revision": "Rev:1.1",
    "sha256": "a35041a8ed9d8ddd02af14288567a5826d249ded1cf1afc8cc265c3638e9aa0a",
    "accessed_date": "2026-08-10",
    "pages_referenced": [
      "p. 1",
      "p. 2",
      "p. 3"
    ],
    "placeholder": false
  }
]
