[
  {
    "kind": "datasheet",
    "url": "https://jlcpcb.com/api/file/downloadByFileSystemAccessId/8564879460828020737",
    "revision": "Rev.1.0",
    "sha256": "58bc7212021acdd0099f74f5574992e2fe4afea33850f27c443c979da297e66c",
    "accessed_date": "2026-08-10",
    "pages_referenced": [
      "p. 1",
      "p. 2",
      "p. 3",
      "p. 4"
    ],
    "placeholder": false
  }
]
