[
  {
    "kind": "datasheet",
    "url": "https://jlcpcb.com/api/file/downloadByFileSystemAccessId/8588905223956148224",
    "revision": "unspecified",
    "sha256": "a3e9f47bdf109d50fab65d57d74e4fd696c4f2cb21f264177c172d20c6170676",
    "accessed_date": "2026-08-10",
    "pages_referenced": [
      "1",
      "2",
      "3"
    ],
    "placeholder": false
  }
]
