[
  {
    "kind": "datasheet",
    "url": "https://jlcpcb.com/api/file/downloadByFileSystemAccessId/8588880657325547520",
    "revision": "PD-97432, 11/4/09",
    "sha256": "0b592b8acbf8028ff526c5f394fb97e3434521217032b0fd64c29d9f0a7e0998",
    "accessed_date": "2026-08-10",
    "pages_referenced": [
      "p. 1",
      "p. 2",
      "p. 3",
      "p. 4",
      "p. 5",
      "p. 6",
      "p. 7",
      "p. 8",
      "p. 9",
      "p. 10"
    ],
    "placeholder": false
  }
]
