[
  {
    "kind": "datasheet",
    "url": "https://jlcpcb.com/api/file/downloadByFileSystemAccessId/8564879085702189056",
    "revision": "Rev:1.0",
    "sha256": "64aade9d6c8bcc630328e7b0e3a958d2e8a83c0e2e2b23ab0c7cb96acffbf112",
    "accessed_date": "2026-08-10",
    "pages_referenced": [
      "p. 1",
      "p. 2",
      "p. 3",
      "p. 4",
      "p. 5"
    ],
    "placeholder": false
  }
]
