[
  {
    "kind": "datasheet",
    "url": "https://jlcpcb.com/api/file/downloadByFileSystemAccessId/8590908171483897856",
    "revision": "V2.0",
    "sha256": "35906e1155d562ddfd883afab85901885c93201f67a555950729ffad3df51af4",
    "accessed_date": "2026-08-10",
    "pages_referenced": [
      "p. 1",
      "p. 2",
      "p. 3",
      "p. 4",
      "p. 5"
    ],
    "placeholder": false
  }
]
