[
  {
    "kind": "datasheet",
    "url": "https://jlcpcb.com/api/file/downloadByFileSystemAccessId/8564879733340340224",
    "revision": "Rev:1.0",
    "sha256": "5c2144b4baf9ff4f74de3ec964db7cface6363cacdd08879c7be92001411cc20",
    "accessed_date": "2026-08-09",
    "pages_referenced": [
      "p. 1",
      "p. 2",
      "p. 3",
      "p. 4",
      "p. 5"
    ],
    "placeholder": false
  }
]
