[
  {
    "kind": "datasheet",
    "url": "https://jlcpcb.com/api/file/downloadByFileSystemAccessId/8602925656347066368",
    "revision": "Rev 1.0",
    "sha256": "a42cb666e61d65c570d8835b077a3c6baf9456538ad50994264cdee274402975",
    "accessed_date": "2026-08-10",
    "pages_referenced": [
      "p. 1",
      "p. 2",
      "p. 3"
    ],
    "placeholder": false
  }
]
