[
  {
    "kind": "datasheet",
    "url": "https://jlcpcb.com/api/file/downloadByFileSystemAccessId/8757771037301841920",
    "revision": "revision not stated in source",
    "sha256": "c223360cd3202ceeb5a05c3467035bb2e919dc6838ad04139c649522ec7e7b7c",
    "accessed_date": "2026-08-23",
    "pages_referenced": [
      "p. 1",
      "p. 2",
      "p. 3",
      "p. 4"
    ],
    "placeholder": false
  }
]
