[
  {
    "kind": "datasheet",
    "url": "https://jlcpcb.com/api/file/downloadByFileSystemAccessId/8602990857909907456",
    "revision": "Rev:1.0",
    "sha256": "20da722d7ee5a1a0b66b37f2e138cff5e24c108e6dfe6c03b89f75fe57109826",
    "accessed_date": "2026-08-10",
    "pages_referenced": [
      "p. 1",
      "p. 2"
    ],
    "placeholder": false
  }
]
