[
  {
    "kind": "datasheet",
    "url": "https://jlcpcb.com/api/file/downloadByFileSystemAccessId/8604416409044590592",
    "revision": "Revision not stated; document dated 2019-07-12",
    "sha256": "e6daf36bbd695c648e9f9ea8afc1a260946df0d1b8adddfe5ccabbda07149db3",
    "accessed_date": "2026-08-10",
    "pages_referenced": [
      "p. 1",
      "p. 2",
      "p. 3",
      "p. 4",
      "p. 5"
    ],
    "placeholder": false
  }
]
