[
  {
    "kind": "datasheet",
    "url": "https://jlcpcb.com/api/file/downloadByFileSystemAccessId/8603186766492803072",
    "revision": "Rev:1.0",
    "sha256": "84a88bbc2a0ec138272da8698a134cd526293f596f2f5ee86fe6778f8a23cab5",
    "accessed_date": "2026-08-10",
    "pages_referenced": [
      "p. 1",
      "p. 2",
      "p. 3"
    ],
    "placeholder": false
  }
]
