[
  {
    "kind": "datasheet",
    "url": "https://jlcpcb.com/api/file/downloadByFileSystemAccessId/8588912792803397632",
    "revision": "Rev. - 1.0",
    "sha256": "12a2448a9538e053202a478247c1b7f007b72fa47c303e23f557594a36895a64",
    "accessed_date": "2026-08-10",
    "pages_referenced": [
      "p. 1",
      "p. 2",
      "p. 3",
      "p. 4"
    ],
    "placeholder": false
  }
]
