[
  {
    "kind": "datasheet",
    "url": "https://jlcpcb.com/api/file/downloadByFileSystemAccessId/8590903646676725760",
    "revision": "Rev:1.0",
    "sha256": "ff9ffec6637ec84cf1396d252c9f17c31704d158c2e147b88c42d9f1e43a10d2",
    "accessed_date": "2026-08-09",
    "pages_referenced": [
      "p. 1",
      "p. 2",
      "p. 3"
    ],
    "placeholder": false
  }
]
